{
  "$schema": "https://json-schema.org/draft/2020-12/schema",
  "$id": "https://schemas.holobike.local/HolobikeDeployment/Schemas/record.schema.json",
  "title": "Run record",
  "description": "What one Assembler run resolved and attested. The shape follows the run-record idiom this ecosystem already proved (a run block with timing, a source-identity block, per-subject facts) hardened with provenance vocabulary: 'revision' is a full git commit id and corresponds to SLSA's digest.gitCommit; the deployment block is the record's self-identity, because a resolution that cannot identify itself is not provenance. Records are written by runs into the untracked Artifacts/ directory and are never edited; admission copies a record into Releases/, it does not rewrite one.",
  "type": "object",
  "additionalProperties": false,
  "required": ["schema_version", "kind", "run", "deployment", "line", "problems"],
  "allOf": [
    {
      "if": { "properties": { "kind": { "const": "resolution" } } },
      "then": {
        "required": ["resolved", "gates"],
        "properties": { "actions": false, "profile": false,
                        "builds": false, "artifacts": false,
                        "resolution": false, "bundle": false,
                        "assembly": false, "members": false }
      }
    },
    {
      "if": { "properties": { "kind": { "const": "bootstrap" } } },
      "then": {
        "required": ["actions"],
        "properties": { "resolved": false, "gates": false,
                        "profile": false, "builds": false,
                        "artifacts": false, "resolution": false,
                        "bundle": false, "assembly": false,
                        "members": false }
      }
    },
    {
      "if": { "properties": { "kind": { "const": "assembly" } } },
      "then": {
        "required": ["profile", "resolution", "builds", "artifacts",
                     "bundle"],
        "properties": { "resolved": false, "gates": false,
                        "actions": false, "assembly": false,
                        "members": false }
      }
    },
    {
      "if": { "properties": { "kind": { "const": "emulation" } } },
      "then": {
        "required": ["profile", "assembly", "members"],
        "properties": { "resolved": false, "gates": false,
                        "actions": false, "resolution": false,
                        "builds": false, "artifacts": false,
                        "bundle": false }
      }
    }
  ],
  "properties": {
    "schema_version": { "const": 1 },
    "kind": { "enum": ["resolution", "bootstrap", "assembly", "emulation"] },
    "run": {
      "type": "object",
      "additionalProperties": false,
      "required": ["verb", "started_at_utc", "finished_at_utc"],
      "properties": {
        "verb": { "enum": ["resolve", "bootstrap", "assemble", "emulate"] },
        "started_at_utc": { "type": "string", "minLength": 1, "pattern": "Z$" },
        "finished_at_utc": { "type": "string", "minLength": 1, "pattern": "Z$" }
      }
    },
    "deployment": {
      "type": "object",
      "additionalProperties": false,
      "required": ["revision", "dirty"],
      "properties": {
        "revision": { "type": "string", "pattern": "^[0-9a-f]{40}$" },
        "dirty": { "type": "boolean" }
      }
    },
    "line": { "type": "string", "minLength": 1 },
    "resolved": {
      "type": "object",
      "minProperties": 1,
      "additionalProperties": false,
      "properties": {
        "uroborOS": { "$ref": "#/$defs/resolution" },
        "HexAtlas": { "$ref": "#/$defs/resolution" },
        "Assetscape": { "$ref": "#/$defs/resolution" },
        "HolobikeCore": { "$ref": "#/$defs/resolution" },
        "AthleteIdentity": { "$ref": "#/$defs/resolution" },
        "drAIs": { "$ref": "#/$defs/resolution" },
        "HolobikeExperience": { "$ref": "#/$defs/resolution" },
        "HolobikeDevice": { "$ref": "#/$defs/resolution" },
        "HolobikeRider": { "$ref": "#/$defs/resolution" },
        "HolobikeWorlds": { "$ref": "#/$defs/resolution" }
      }
    },
    "gates": {
      "type": "object",
      "description": "Verdicts from the Policy/ gates evaluated during this run, keyed by gate name. Empty when no policy is declared. A skip is a problem: a gate that silently cannot run reads as coverage that does not exist.",
      "propertyNames": { "pattern": "^[a-z0-9][a-z0-9-]*$" },
      "additionalProperties": { "$ref": "#/$defs/gate_verdict" }
    },
    "actions": {
      "type": "object",
      "description": "bootstrap records only: what materialization did per integration. Bounded mutations exclusively — clone missing, fast-forward clean-on-branch; everything else is a reported status, never a reset.",
      "minProperties": 1,
      "additionalProperties": false,
      "properties": {
        "uroborOS": { "$ref": "#/$defs/action" },
        "HexAtlas": { "$ref": "#/$defs/action" },
        "Assetscape": { "$ref": "#/$defs/action" },
        "HolobikeCore": { "$ref": "#/$defs/action" },
        "AthleteIdentity": { "$ref": "#/$defs/action" },
        "drAIs": { "$ref": "#/$defs/action" },
        "HolobikeExperience": { "$ref": "#/$defs/action" },
        "HolobikeDevice": { "$ref": "#/$defs/action" },
        "HolobikeRider": { "$ref": "#/$defs/action" },
        "HolobikeWorlds": { "$ref": "#/$defs/action" }
      }
    },
    "profile": {
      "type": "string",
      "minLength": 1,
      "pattern": "^[a-z0-9][a-z0-9-]*$"
    },
    "resolution": {
      "type": "object",
      "additionalProperties": false,
      "required": ["record", "line"],
      "description": "assembly records only: the resolution this bundle was built from — a bundle that cannot say what it was built from is not provenance.",
      "properties": {
        "record": { "type": "string", "minLength": 1 },
        "line": { "type": "string", "minLength": 1 }
      }
    },
    "builds": {
      "type": "object",
      "minProperties": 1,
      "propertyNames": {
        "enum": ["uroborOS", "HexAtlas", "Assetscape", "HolobikeCore",
                 "AthleteIdentity", "drAIs", "HolobikeExperience",
                 "HolobikeDevice", "HolobikeRider", "HolobikeWorlds"]
      },
      "additionalProperties": { "$ref": "#/$defs/build_result" }
    },
    "artifacts": {
      "type": "object",
      "propertyNames": {
        "enum": ["uroborOS", "HexAtlas", "Assetscape", "HolobikeCore",
                 "AthleteIdentity", "drAIs", "HolobikeExperience",
                 "HolobikeDevice", "HolobikeRider", "HolobikeWorlds"]
      },
      "additionalProperties": {
        "type": "array",
        "items": { "$ref": "#/$defs/staged_artifact" }
      }
    },
    "bundle": {
      "type": "string",
      "minLength": 1,
      "description": "assembly records only: the bundle directory this run staged, relative to the artifacts root."
    },
    "assembly": {
      "type": "object",
      "additionalProperties": false,
      "required": ["record", "bundle"],
      "description": "emulation records only: the assembly this run executed — the chain reads emulation → assembly → resolution → declaration, and no step can lie about its parent.",
      "properties": {
        "record": { "type": "string", "minLength": 1 },
        "bundle": { "type": "string", "minLength": 1 }
      }
    },
    "members": {
      "type": "object",
      "minProperties": 1,
      "propertyNames": {
        "enum": ["uroborOS", "HexAtlas", "Assetscape", "HolobikeCore",
                 "AthleteIdentity", "drAIs", "HolobikeExperience",
                 "HolobikeDevice", "HolobikeRider", "HolobikeWorlds"]
      },
      "additionalProperties": { "$ref": "#/$defs/member" }
    },
    "problems": {
      "type": "array",
      "items": { "type": "string", "minLength": 1 }
    }
  },
  "$defs": {
    "member": {
      "type": "object",
      "additionalProperties": false,
      "required": ["status", "run"],
      "properties": {
        "status": {
          "enum": ["healthy", "skipped", "spawn_failed", "exited_early",
                   "never_ready", "failed_settle", "unclean_shutdown"]
        },
        "run": { "enum": ["host"] },
        "serve": {
          "type": "object",
          "additionalProperties": false,
          "required": ["argv"],
          "properties": {
            "argv": {
              "type": "array",
              "minItems": 1,
              "items": { "type": "string", "minLength": 1 }
            },
            "env": {
              "type": "object",
              "propertyNames": { "minLength": 1 },
              "additionalProperties": { "type": "string" }
            }
          }
        },
        "probe": {
          "type": "object",
          "additionalProperties": false,
          "required": ["attempts"],
          "properties": {
            "attempts": { "type": "integer", "minimum": 0 },
            "ready_after_ms": { "type": "integer", "minimum": 0 }
          }
        },
        "log": { "type": "string", "minLength": 1 },
        "shutdown": {
          "type": "object",
          "additionalProperties": false,
          "required": ["clean"],
          "properties": {
            "clean": { "type": "boolean" },
            "detail": { "type": "string", "minLength": 1 }
          }
        },
        "detail": { "type": "string", "minLength": 1 }
      }
    },
    "build_result": {
      "type": "object",
      "additionalProperties": false,
      "required": ["status", "steps"],
      "properties": {
        "status": { "enum": ["built", "failed", "skipped"] },
        "steps": {
          "type": "array",
          "items": {
            "type": "object",
            "additionalProperties": false,
            "required": ["argv", "exit", "log"],
            "properties": {
              "argv": {
                "type": "array",
                "minItems": 1,
                "items": { "type": "string", "minLength": 1 }
              },
              "exit": { "type": "integer" },
              "log": { "type": "string", "minLength": 1 }
            }
          }
        },
        "detail": { "type": "string", "minLength": 1 }
      }
    },
    "staged_artifact": {
      "type": "object",
      "additionalProperties": false,
      "required": ["path", "sha256", "bytes"],
      "properties": {
        "path": { "type": "string", "minLength": 1 },
        "sha256": { "type": "string", "pattern": "^[0-9a-f]{64}$" },
        "bytes": { "type": "integer", "minimum": 0 }
      }
    },
    "action": {
      "type": "object",
      "additionalProperties": false,
      "required": ["status"],
      "properties": {
        "status": {
          "enum": ["cloned", "clone_failed", "updated", "up_to_date",
                   "matched", "dirty_skipped", "selection_mismatch",
                   "diverged", "fetch_failed", "unclonable",
                   "unreadable_repository"]
        },
        "detail": { "type": "string", "minLength": 1 },
        "revision_before": { "type": "string" },
        "revision_after": { "type": "string" }
      }
    },
    "gate_verdict": {
      "type": "object",
      "additionalProperties": false,
      "required": ["kind", "status"],
      "properties": {
        "kind": { "enum": ["tree_parity"] },
        "status": { "enum": ["pass", "fail", "skipped"] },
        "counts": {
          "type": "object",
          "additionalProperties": { "type": "integer", "minimum": 0 }
        },
        "mismatches": {
          "type": "array",
          "items": { "type": "string", "minLength": 1 }
        },
        "truncated": { "type": "integer", "minimum": 0 },
        "detail": { "type": "string", "minLength": 1 }
      }
    },
    "resolution": {
      "type": "object",
      "additionalProperties": false,
      "required": ["selected", "status"],
      "properties": {
        "selected": {
          "type": "object",
          "additionalProperties": false,
          "minProperties": 1,
          "maxProperties": 1,
          "properties": {
            "branch": { "type": "string", "minLength": 1 },
            "commit": { "type": "string", "pattern": "^[0-9a-f]{40}$" }
          }
        },
        "status": {
          "enum": ["resolved", "selection_mismatch", "unresolvable"]
        },
        "revision": { "type": "string", "pattern": "^[0-9a-f]{40}$" },
        "branch": { "type": "string" },
        "dirty": { "type": "boolean" },
        "detail": { "type": "string", "minLength": 1 }
      }
    }
  }
}
