{
  "schema_version": 1,
  "kind": "resolution",
  "run": {
    "verb": "resolve",
    "started_at_utc": "2026-08-04T12:00:00Z",
    "finished_at_utc": "2026-08-04T12:00:01Z"
  },
  "deployment": {
    "revision": "a652f43a652f43a652f43a652f43a652f43a6520",
    "dirty": true
  },
  "line": "dev",
  "resolved": {
    "HexAtlas": {
      "selected": { "branch": "main" },
      "status": "selection_mismatch",
      "revision": "0123456789abcdef0123456789abcdef01234567",
      "branch": "feature",
      "dirty": true,
      "detail": "selected branch main, checkout is on feature"
    },
    "AthleteIdentity": {
      "selected": { "commit": "0123456789abcdef0123456789abcdef01234567" },
      "status": "unresolvable",
      "detail": "no checkout declared in the environment mapping"
    }
  },
  "problems": [
    "HexAtlas: selection_mismatch — selected branch main, checkout is on feature",
    "AthleteIdentity: unresolvable — no checkout declared in the environment mapping"
  ]
}
