{
  "schema_version": 1,
  "kind": "bootstrap",
  "run": {
    "verb": "bootstrap",
    "started_at_utc": "2026-08-04T12:00:00Z",
    "finished_at_utc": "2026-08-04T12:00:09Z"
  },
  "deployment": {
    "revision": "a652f43a652f43a652f43a652f43a652f43a6520",
    "dirty": false
  },
  "line": "dev",
  "actions": {
    "HexAtlas": {
      "status": "cloned",
      "revision_after": "0123456789abcdef0123456789abcdef01234567"
    },
    "AthleteIdentity": {
      "status": "updated",
      "revision_before": "0123456789abcdef0123456789abcdef01234567",
      "revision_after": "89abcdef0123456789abcdef0123456789abcdef"
    },
    "HolobikeExperience": {
      "status": "dirty_skipped",
      "detail": "working tree is dirty; bootstrap never resets",
      "revision_before": "0123456789abcdef0123456789abcdef01234567"
    }
  },
  "problems": [
    "HolobikeExperience: dirty_skipped — working tree is dirty; bootstrap never resets"
  ]
}
